{
  "case_id": "SP16-V13-SHEET-001",
  "standard": "СП 16.13330.2017",
  "action": "sheet_structures_strength_and_stability",
  "working_condition_factor": 1.0,
  "design_yield_resistance_n_mm2": 355.0,
  "elastic_modulus_n_mm2": 206000.0,
  "sigma_x_n_mm2": 100.0,
  "sigma_y_n_mm2": 40.0,
  "tau_xy_n_mm2": 20.0,
  "tension_design_resistance_n_mm2": 355.0,
  "compression_design_resistance_n_mm2": 355.0,
  "projected_pressure_force_n": 544139.8092702653,
  "pressure_n_mm2": 1.0,
  "shell_radius_mm": 3000.0,
  "shell_thickness_mm": 10.0,
  "beta_degrees": 30.0,
  "meridional_radius_mm": 3000.0,
  "circumferential_radius_mm": 3000.0,
  "cylinder_axial_compressive_stress_n_mm2": 60.0,
  "cylinder_minimum_signed_stress_n_mm2": -20.0,
  "cylinder_shear_stress_n_mm2": 0.0,
  "tube_axial_force_n": 100000.0,
  "tube_relative_slenderness": 1.0,
  "tube_area_mm2": 2000.0,
  "tube_relative_eccentricity_m": 0.2,
  "tube_radius_mm": 1000.0,
  "tube_thickness_mm": 20.0,
  "panel_width_mm": 300.0,
  "panel_compressive_stress_n_mm2": 319.5,
  "external_cylinder_radius_mm": 1000.0,
  "external_cylinder_thickness_mm": 10.0,
  "external_cylinder_length_mm": 15000.0,
  "external_pressure_n_mm2": 0.01,
  "ring_spacing_mm": 500.0,
  "cone_top_radius_mm": 500.0,
  "cone_bottom_radius_mm": 906.6948930938207,
  "cone_height_mm": 2000.0,
  "cone_thickness_mm": 10.0,
  "cone_axial_force_n": 100000.0,
  "cone_external_pressure_n_mm2": 0.01,
  "sphere_radius_mm": 5000.0,
  "sphere_thickness_mm": 10.0,
  "sphere_external_pressure_n_mm2": 0.01,
  "has_geometry_thickness_or_load_discontinuity": true,
  "arbitrary_configuration_or_spatial_state": true,
  "tube_axial_critical_stress_n_mm2": 100.0
}
